author_name,affliations,article_title,doi,volume,type
A. Rey,Professor of Physical Chemistry,False-Name Manipulation in Weighted Voting Games is Hard for Probabilistic Polynomial Time,10.1613/jair.4293,Vol. 50 (2014),article
J. Rothe,"Professor of Computer Science, Heinrich-Heine-Universit‰t D¸sseldorf",False-Name Manipulation in Weighted Voting Games is Hard for Probabilistic Polynomial Time,10.1613/jair.4293,Vol. 50 (2014),article
E. Keyder,"Postdoctoral researcher, INRIA",Improving Delete Relaxation Heuristics Through Explicitly Represented Conjunctions,10.1613/jair.4277,Vol. 50 (2014),article
J. Hoffmann,"Professor of Computer Science, Saarland Informatics Campus, Saarland University, Saarbruecken",Improving Delete Relaxation Heuristics Through Explicitly Represented Conjunctions,10.1613/jair.4277,Vol. 50 (2014),article
P. Haslum,Unknown affiliation,Improving Delete Relaxation Heuristics Through Explicitly Represented Conjunctions,10.1613/jair.4277,Vol. 50 (2014),article
D. Terekhov,"Assistant Professor, Industrial Engineering, Concordia University",Integrating Queueing Theory and Scheduling for Dynamic Scheduling Problems,10.1613/jair.4278,Vol. 50 (2014),article
T. T. Tran,"University of Massachusetts, Amherst. Twitter, Inc. LinkedIn",Integrating Queueing Theory and Scheduling for Dynamic Scheduling Problems,10.1613/jair.4278,Vol. 50 (2014),article
D. G. Down,McMaster University,Integrating Queueing Theory and Scheduling for Dynamic Scheduling Problems,10.1613/jair.4278,Vol. 50 (2014),article
J.C. Beck,"Professor of Mechanical and Industrial Engineering, University of Toronto",Integrating Queueing Theory and Scheduling for Dynamic Scheduling Problems,10.1613/jair.4278,Vol. 50 (2014),article
M. Cooper,"Professor of Physics & Astronomy, University of California Irvine","Monotone Temporal Planning: Tractability, Extensions and Applications",10.1613/jair.4358,Vol. 50 (2014),article
F. Maris,"Associate Professor of Computer Science, University of Toulouse","Monotone Temporal Planning: Tractability, Extensions and Applications",10.1613/jair.4358,Vol. 50 (2014),article
P. RÈgnier,ULB,"Monotone Temporal Planning: Tractability, Extensions and Applications",10.1613/jair.4358,Vol. 50 (2014),article
R. Bredereck,TU Berlin,A Multivariate Complexity Analysis of Lobbying in Multiple Referenda,10.1613/jair.4285,Vol. 50 (2014),article
J. Chen,"Prof. of Computer Science, Queens College",A Multivariate Complexity Analysis of Lobbying in Multiple Referenda,10.1613/jair.4285,Vol. 50 (2014),article
S. Hartung,University of Hamburg,A Multivariate Complexity Analysis of Lobbying in Multiple Referenda,10.1613/jair.4285,Vol. 50 (2014),article
S. Kratsch,Professor at Humboldt University Berlin,A Multivariate Complexity Analysis of Lobbying in Multiple Referenda,10.1613/jair.4285,Vol. 50 (2014),article
R. Niedermeier,"Professor of Theoretical Computer Science, TU Berlin",A Multivariate Complexity Analysis of Lobbying in Multiple Referenda,10.1613/jair.4285,Vol. 50 (2014),article
O. Suchy,"Assistant Professor of Theoretical Computer Science, Czech Technical University",A Multivariate Complexity Analysis of Lobbying in Multiple Referenda,10.1613/jair.4285,Vol. 50 (2014),article
G. J. Woeginger,"Professor of Computer Science, RWTH Aachen",A Multivariate Complexity Analysis of Lobbying in Multiple Referenda,10.1613/jair.4285,Vol. 50 (2014),article
J.R. Doppa,"George and Joan Berry Chair Assistant Professor, Computer Science, Washington State University",HC-Search: A Learning Framework for Search-based Structured Prediction,10.1613/jair.4212,Vol. 50 (2014),article
A. Fern,Oregon State University,HC-Search: A Learning Framework for Search-based Structured Prediction,10.1613/jair.4212,Vol. 50 (2014),article
P. Tadepalli,"Professor of Computer Science, Oregon State University",HC-Search: A Learning Framework for Search-based Structured Prediction,10.1613/jair.4212,Vol. 50 (2014),article
F.M. Delle Fave,Mind Foundry ltd.,Game-Theoretic Patrolling with Dynamic Execution Uncertainty and a Case Study on a Real Transit System,10.1613/jair.4317,Vol. 50 (2014),article
A.X. Jiang,"Assistant Professor of Computer Science, Trinity University",Game-Theoretic Patrolling with Dynamic Execution Uncertainty and a Case Study on a Real Transit System,10.1613/jair.4317,Vol. 50 (2014),article
Z. Yin,Null,Game-Theoretic Patrolling with Dynamic Execution Uncertainty and a Case Study on a Real Transit System,10.1613/jair.4317,Vol. 50 (2014),article
C. Zhang,University of Washington,Game-Theoretic Patrolling with Dynamic Execution Uncertainty and a Case Study on a Real Transit System,10.1613/jair.4317,Vol. 50 (2014),article
M. Tambe,"Director CRCS Center & CS Professor @Harvard; Director ""AI for Social Good"" @Google Research India",Game-Theoretic Patrolling with Dynamic Execution Uncertainty and a Case Study on a Real Transit System,10.1613/jair.4317,Vol. 50 (2014),article
S. Kraus,"Professor Of Computer Science, Bar-Ilan University",Game-Theoretic Patrolling with Dynamic Execution Uncertainty and a Case Study on a Real Transit System,10.1613/jair.4317,Vol. 50 (2014),article
J. P. Sullivan,Null,Game-Theoretic Patrolling with Dynamic Execution Uncertainty and a Case Study on a Real Transit System,10.1613/jair.4317,Vol. 50 (2014),article
M. Suda,Czech Technical University in Prague,Property Directed Reachability for Automated Planning,10.1613/jair.4231,Vol. 50 (2014),article
N. Rivera,Molecular Biology Institute of Barcelona ,Reconnection with the Ideal Tree: A New Approach to Real-Time Search,10.1613/jair.4292,Vol. 50 (2014),article
L. Illanes,"PhD Student, University of Toronto",Reconnection with the Ideal Tree: A New Approach to Real-Time Search,10.1613/jair.4292,Vol. 50 (2014),article
J. A. Baier,Pontificia Universidad CatÛlica de Chile,Reconnection with the Ideal Tree: A New Approach to Real-Time Search,10.1613/jair.4292,Vol. 50 (2014),article
C. Hernandez,"Biomedical Engineering Department, Case Western Reserve University",Reconnection with the Ideal Tree: A New Approach to Real-Time Search,10.1613/jair.4292,Vol. 50 (2014),article
M. Goldenberg,Jerusalem College of Technology,Enhanced Partial Expansion A*,10.1613/jair.4171,Vol. 50 (2014),article
A. Felner,Ben-Gurion University,Enhanced Partial Expansion A*,10.1613/jair.4171,Vol. 50 (2014),article
R. Stern,University of Sheffield,Enhanced Partial Expansion A*,10.1613/jair.4171,Vol. 50 (2014),article
G. Sharon,Texas A&M University,Enhanced Partial Expansion A*,10.1613/jair.4171,Vol. 50 (2014),article
N. Sturtevant,University of Alberta,Enhanced Partial Expansion A*,10.1613/jair.4171,Vol. 50 (2014),article
R. C. Holte,University of Alberta,Enhanced Partial Expansion A*,10.1613/jair.4171,Vol. 50 (2014),article
J. Schaeffer,University of Alberta,Enhanced Partial Expansion A*,10.1613/jair.4171,Vol. 50 (2014),article
J. De Bock,Ghent University,An Efficient Algorithm for Estimating State Sequences in Imprecise Hidden Markov Models,10.1613/jair.4385,Vol. 50 (2014),article
G. de Cooman,"Professor in Uncertainty Modelling and Systems Science, Ghent University",An Efficient Algorithm for Estimating State Sequences in Imprecise Hidden Markov Models,10.1613/jair.4385,Vol. 50 (2014),article
B. de Keijzer,"Postdoctoral researcher, Centrum Wiskunde & Informatica (CWI)",Finding Optimal Solutions for Voting Game Design Problems,10.1613/jair.4109,Vol. 50 (2014),article
T. B. Klos,"Assistant professor of Algorithmics, University of Utrecht",Finding Optimal Solutions for Voting Game Design Problems,10.1613/jair.4109,Vol. 50 (2014),article
Y. Zhang,University of Michigan,Finding Optimal Solutions for Voting Game Design Problems,10.1613/jair.4109,Vol. 50 (2014),article
A. Fern,Oregon State University,A Decision-Theoretic Model of Assistance,10.1613/jair.4213,Vol. 50 (2014),article
S. Natarajan,"Professor of Agronomy, Annamalai University",A Decision-Theoretic Model of Assistance,10.1613/jair.4213,Vol. 50 (2014),article
K. Judah,"Lookout, Inc.",A Decision-Theoretic Model of Assistance,10.1613/jair.4213,Vol. 50 (2014),article
P. Tadepalli,"Professor of Computer Science, Oregon State University",A Decision-Theoretic Model of Assistance,10.1613/jair.4213,Vol. 50 (2014),article
Y. Wang,"Professor, School of Information Engineering, Nanchang University",Knowledge Forgetting in Answer Set Programming,10.1613/jair.4297,Vol. 50 (2014),article
Y. Zhang,"Post Doctoral Fellow in Bioinformatics, University of Texas Southwestern Medical Center",Knowledge Forgetting in Answer Set Programming,10.1613/jair.4297,Vol. 50 (2014),article
Y. Zhou,Unknown affiliation,Knowledge Forgetting in Answer Set Programming,10.1613/jair.4297,Vol. 50 (2014),article
M. Zhang,GE Healthcare,Knowledge Forgetting in Answer Set Programming,10.1613/jair.4297,Vol. 50 (2014),article
M. Zhang,GE Healthcare,Topic-Based Dissimilarity and Sensitivity Models for Translation Rule Selection,10.1613/jair.4265,Vol. 50 (2014),article
X. Xiao,Null,Topic-Based Dissimilarity and Sensitivity Models for Translation Rule Selection,10.1613/jair.4265,Vol. 50 (2014),article
D. Xiong,Null,Topic-Based Dissimilarity and Sensitivity Models for Translation Rule Selection,10.1613/jair.4265,Vol. 50 (2014),article
Q. Liu,GuangDong University of Technology,Topic-Based Dissimilarity and Sensitivity Models for Translation Rule Selection,10.1613/jair.4265,Vol. 50 (2014),article
Aaron Hunter,University of Notre Dame,Belief Change with Uncertain Action Histories,10.1613/jair.4558,Vol. 53 (2015),article
James Delgrande,Simon Fraser University ∑ School of Computing Science,Belief Change with Uncertain Action Histories,10.1613/jair.4558,Vol. 53 (2015),article
Marius Lindauer,University of Freiburg,AutoFolio: An Automatically Configured Algorithm Selector,10.1613/jair.4726,Vol. 53 (2015),article
Holger H. Hoos,Leiden University | LEI ∑ Leiden Institute of Advanced Computer Science,AutoFolio: An Automatically Configured Algorithm Selector,10.1613/jair.4726,Vol. 53 (2015),article
Frank Hutter,University of Freiburg | Albert-Ludwigs-Universit‰t Freiburg ∑ Department of Computer Science,AutoFolio: An Automatically Configured Algorithm Selector,10.1613/jair.4726,Vol. 53 (2015),article
Torsten Schaub,"University of Potsdam, Germany",AutoFolio: An Automatically Configured Algorithm Selector,10.1613/jair.4726,Vol. 53 (2015),article
Piotr Krysta,"University of Liverpool, UK",Mechanisms for Multi-unit Combinatorial Auctions with a Few Distinct Goods,10.1613/jair.4587,Vol. 53 (2015),article
Orestis Telelis,University of Piraeus,Mechanisms for Multi-unit Combinatorial Auctions with a Few Distinct Goods,10.1613/jair.4587,Vol. 53 (2015),article
Carmine Ventre,King's College London,Mechanisms for Multi-unit Combinatorial Auctions with a Few Distinct Goods,10.1613/jair.4587,Vol. 53 (2015),article
Johan Kwisthout,Radboud University | RU ∑ Business and Law Research Centre (OO&R),Tree-Width and the Computational Complexity of MAP Approximations in Bayesian Networks,10.1613/jair.4794,Vol. 53 (2015),article
Tatsuya Imai,Nanzan University ∑ Department of British and American Studies,"On a Practical,  Integer-Linear Programming Model for Delete-Free Tasks and its Use as a Heuristic for Cost-Optimal Planning",10.1613/jair.4936,Vol. 54 (2015),article
Alex Fukunaga,Harvard University ,"On a Practical,  Integer-Linear Programming Model for Delete-Free Tasks and its Use as a Heuristic for Cost-Optimal Planning",10.1613/jair.4936,Vol. 54 (2015),article
Andreas Steigmiller,Ulm University,Pay-As-You-Go Description Logic Reasoning by Coupling Tableau and Saturation Procedures,10.1613/jair.4897,Vol. 54 (2015),article
Birte Glimm,Ulm University,Pay-As-You-Go Description Logic Reasoning by Coupling Tableau and Saturation Procedures,10.1613/jair.4897,Vol. 54 (2015),article
Ben Strasser,Karlsruhe Institute of Technology | KIT ∑ Institute of Theoretical Informatics,Compressing Optimal Paths with Run Length Encoding,10.1613/jair.4931,Vol. 54 (2015),article
Adi Botea,IBM ∑ Smarter Cities Technology Centre,Compressing Optimal Paths with Run Length Encoding,10.1613/jair.4931,Vol. 54 (2015),article
Daniel Harabor,Monash University (Australia),Compressing Optimal Paths with Run Length Encoding,10.1613/jair.4931,Vol. 54 (2015),article
Haris Aziz,National ICT Australia Ltd | NICTA ∑ Optimisation Research Group (ORG@NICTA),Possible and Necessary Winners of Partial Tournaments,10.1613/jair.4856,Vol. 54 (2015),article
Markus Brill,Technische Universit‰t Berlin,Possible and Necessary Winners of Partial Tournaments,10.1613/jair.4856,Vol. 54 (2015),article
Felix Fischer,Lawrence Berkeley National Laboratory,Possible and Necessary Winners of Partial Tournaments,10.1613/jair.4856,Vol. 54 (2015),article
Paul Harrenstein,"Post-doctoral researcher, University of Oxford",Possible and Necessary Winners of Partial Tournaments,10.1613/jair.4856,Vol. 54 (2015),article
Jerome Lang,chercheur CNRS,Possible and Necessary Winners of Partial Tournaments,10.1613/jair.4856,Vol. 54 (2015),article
Hans Georg Seedig,Technische Universit‰t M¸nchen,Possible and Necessary Winners of Partial Tournaments,10.1613/jair.4856,Vol. 54 (2015),article
Fazlul Hasan Siddiqui,"Dhaka University of Engineering & Technology, Gazipur ∑ Computer Science and Engineering",Continuing Plan Quality Optimisation,10.1613/jair.4980,Vol. 54 (2015),article
Patrik Haslum,Australian National University | ANU ∑ College of Engineering & Computer Science,Continuing Plan Quality Optimisation,10.1613/jair.4980,Vol. 54 (2015),article
Joseph Y. Halpern,Cornell University | CU ∑ Department of Computer Science,Weighted Regret-Based Likelihood: A New Approach to Describing Uncertainty,10.1613/jair.4859,Vol. 54 (2015),article
Igor Rochlin,College of Management Academic Studies ∑ School of Computer Science,Constraining Information Sharing to Improve Cooperative Information Gathering,10.1613/jair.4613,Vol. 54 (2015),article
David Sarne,University of Chicago,Constraining Information Sharing to Improve Cooperative Information Gathering,10.1613/jair.4613,Vol. 54 (2015),article
